{
  "schema_version": "1.0.0",
  "camera_model": "OPENCV",
  "fl_x": 500.000000,
  "fl_y": 501.000000,
  "cx": 320.000000,
  "cy": 240.000000,
  "w": 640,
  "h": 480,
  "camera_angle_x": 0.635539,
  "k1": 0.0,
  "k2": 0.0,
  "p1": 0.0,
  "p2": 0.0,
  "frames": [
    {
      "file_path": "images/frame_00000.jpg",
      "timestamp_ns": 111,
      "fl_x": 500.000000,
      "fl_y": 501.000000,
      "cx": 320.000000,
      "cy": 240.000000,
      "transform_matrix": [
        [1.0, 0.0, 0.0, 0.0],
        [0.0, 1.0, 0.0, 0.0],
        [0.0, 0.0, 1.0, 0.0],
        [0.0, 0.0, 0.0, 1.0]
      ]
    },
    {
      "file_path": "images/frame_00001.jpg",
      "timestamp_ns": 222,
      "fl_x": 505.000000,
      "fl_y": 506.000000,
      "cx": 320.000000,
      "cy": 240.000000,
      "transform_matrix": [
        [1.0, 0.0, 0.0, 1.0],
        [0.0, 1.0, 0.0, 0.0],
        [0.0, 0.0, 1.0, 0.0],
        [0.0, 0.0, 0.0, 1.0]
      ]
    }
  ]
}
